{
  "$schema": "https://json-schema.org/draft/2020-12/schema",
  "$id": "https://raw.githubusercontent.com/macel94/belacca-status/main/status.schema.json",
  "title": "Belacca automated public status contract",
  "type": "object",
  "additionalProperties": false,
  "required": [
    "$schema",
    "schema_version",
    "sanitized",
    "publication_state",
    "status",
    "summary",
    "observation_id",
    "observed_at",
    "updated_at",
    "evidence_timestamp",
    "valid_until",
    "publisher",
    "monitoring_policy",
    "uptime",
    "components",
    "incidents",
    "source_references",
    "notes"
  ],
  "properties": {
    "$schema": { "type": "string", "format": "uri-reference" },
    "schema_version": { "const": "belacca.public-status.v2" },
    "sanitized": { "const": true },
    "publication_state": { "enum": ["not_configured", "published"] },
    "status": { "enum": ["operational", "degraded", "incident", "unknown"] },
    "summary": { "type": "string", "minLength": 1, "maxLength": 240 },
    "observation_id": { "type": ["string", "null"], "maxLength": 120 },
    "observed_at": { "type": ["string", "null"], "format": "date-time" },
    "updated_at": { "type": ["string", "null"], "format": "date-time" },
    "evidence_timestamp": { "type": ["string", "null"], "format": "date-time" },
    "valid_until": { "type": ["string", "null"], "format": "date-time" },
    "publisher": {
      "type": "object",
      "additionalProperties": false,
      "required": ["name", "source_reference"],
      "properties": {
        "name": { "type": ["string", "null"], "maxLength": 120 },
        "source_reference": { "type": ["string", "null"], "maxLength": 500 }
      }
    },
    "monitoring_policy": {
      "type": ["object", "null"],
      "additionalProperties": false,
      "required": ["id", "approved_by", "approved_at", "runner", "interval", "freshness_ttl", "failure_threshold", "recovery_threshold"],
      "properties": {
        "id": { "type": "string", "minLength": 1, "maxLength": 120 },
        "approved_by": { "type": "string", "minLength": 1, "maxLength": 120 },
        "approved_at": { "type": "string", "format": "date-time" },
        "runner": { "type": "string", "minLength": 1, "maxLength": 120 },
        "interval": { "type": "string", "minLength": 1, "maxLength": 40 },
        "freshness_ttl": { "type": "string", "minLength": 1, "maxLength": 40 },
        "failure_threshold": { "type": "integer", "minimum": 1, "maximum": 10 },
        "recovery_threshold": { "type": "integer", "minimum": 1, "maximum": 10 }
      }
    },
    "uptime": {
      "type": "object",
      "additionalProperties": false,
      "required": ["state", "value", "window", "source_reference"],
      "properties": {
        "state": { "enum": ["not_configured", "reported"] },
        "value": { "type": ["number", "null"], "minimum": 0, "maximum": 100 },
        "window": { "type": "string", "minLength": 1, "maxLength": 40 },
        "source_reference": { "type": ["string", "null"], "maxLength": 500 },
        "observations": { "type": ["integer", "null"], "minimum": 0 },
        "good_observations": { "type": ["integer", "null"], "minimum": 0 },
        "bad_observations": { "type": ["integer", "null"], "minimum": 0 }
      },
      "allOf": [
        {
          "if": { "properties": { "state": { "const": "reported" } } },
          "then": { "properties": { "value": { "type": "number" }, "source_reference": { "type": "string", "minLength": 1 } } }
        },
        {
          "if": { "properties": { "state": { "const": "not_configured" } } },
          "then": { "properties": { "value": { "const": null }, "source_reference": { "const": null } } }
        }
      ]
    },
    "components": {
      "type": "array",
      "maxItems": 20,
      "items": {
        "type": "object",
        "additionalProperties": false,
        "required": ["id", "name", "critical", "status", "summary", "evidence_timestamp", "source_references"],
        "properties": {
          "id": { "type": "string", "minLength": 1, "maxLength": 80 },
          "name": { "type": "string", "minLength": 1, "maxLength": 100 },
          "critical": { "type": "boolean" },
          "status": { "enum": ["operational", "degraded", "incident", "unknown"] },
          "summary": { "type": "string", "minLength": 1, "maxLength": 240 },
          "evidence_timestamp": { "type": "string", "format": "date-time" },
          "duration_ms": { "type": "integer", "minimum": 0, "maximum": 120000 },
          "source_references": { "type": "array", "minItems": 1, "maxItems": 10, "items": { "type": "string", "minLength": 1, "maxLength": 500 } }
        }
      }
    },
    "incidents": {
      "type": "array",
      "maxItems": 20,
      "items": {
        "type": "object",
        "additionalProperties": false,
        "required": ["id", "status", "summary", "started_at", "updated_at", "source_references"],
        "properties": {
          "id": { "type": "string", "minLength": 1, "maxLength": 100 },
          "status": { "enum": ["investigating", "identified", "monitoring", "resolved"] },
          "summary": { "type": "string", "minLength": 1, "maxLength": 240 },
          "started_at": { "type": "string", "format": "date-time" },
          "updated_at": { "type": "string", "format": "date-time" },
          "source_references": { "type": "array", "minItems": 1, "maxItems": 10, "items": { "type": "string", "minLength": 1, "maxLength": 500 } }
        }
      }
    },
    "source_references": { "type": "array", "minItems": 1, "maxItems": 20, "items": { "type": "string", "minLength": 1, "maxLength": 500 } },
    "notes": { "type": "array", "maxItems": 20, "items": { "type": "string", "maxLength": 500 } }
  },
  "allOf": [
    {
      "if": { "properties": { "publication_state": { "const": "not_configured" } } },
      "then": {
        "properties": {
          "status": { "const": "unknown" },
          "observation_id": { "const": null },
          "observed_at": { "const": null },
          "updated_at": { "const": null },
          "evidence_timestamp": { "const": null },
          "valid_until": { "const": null },
          "monitoring_policy": { "const": null },
          "components": { "type": "array", "maxItems": 0 },
          "incidents": { "type": "array", "maxItems": 0 }
        }
      }
    },
    {
      "if": { "properties": { "publication_state": { "const": "published" } } },
      "then": {
        "properties": {
          "observation_id": { "type": "string", "minLength": 1 },
          "observed_at": { "type": "string", "format": "date-time" },
          "updated_at": { "type": "string", "format": "date-time" },
          "evidence_timestamp": { "type": "string", "format": "date-time" },
          "valid_until": { "type": "string", "format": "date-time" },
          "publisher": { "type": "object" },
          "monitoring_policy": { "type": "object" },
          "components": { "type": "array", "minItems": 1 }
        }
      }
    }
  ]
}
