{
  "$schema": "https://raw.githubusercontent.com/macel94/belacca-status/main/status.schema.json",
  "schema_version": "belacca.public-status.v2",
  "sanitized": true,
  "publication_state": "published",
  "status": "operational",
  "summary": "All critical public checks are passing.",
  "observation_id": "38573974679",
  "observed_at": "2026-10-14T13:42:12.161Z",
  "updated_at": "2026-10-14T13:42:12.161Z",
  "evidence_timestamp": "2026-10-14T13:42:12.161Z",
  "valid_until": "2026-10-14T15:42:12.161Z",
  "publisher": {
    "name": "Belacca hourly status monitor",
    "source_reference": "https://github.com/macel94/belacca-status/actions/runs/38573974679"
  },
  "monitoring_policy": {
    "id": "belacca-status-hourly-v1",
    "approved_by": "Francesco Belacca",
    "approved_at": "2026-08-06T00:00:00Z",
    "runner": "GitHub-hosted Actions runner",
    "interval": "1h",
    "freshness_ttl": "2h",
    "failure_threshold": 2,
    "recovery_threshold": 2
  },
  "uptime": {
    "state": "reported",
    "value": 100,
    "window": "available history / 24h",
    "observations": 5,
    "good_observations": 5,
    "bad_observations": 0,
    "source_reference": "https://github.com/macel94/belacca-status/actions/runs/38573974679"
  },
  "components": [
    {
      "id": "portfolio",
      "name": "Portfolio",
      "critical": true,
      "status": "operational",
      "summary": "All configured external checks passed.",
      "evidence_timestamp": "2026-10-14T13:42:12.161Z",
      "duration_ms": 700,
      "source_references": [
        "https://github.com/macel94/belacca-status/actions/runs/38573974679",
        "https://github.com/macel94/belacca-status/tree/main/history#portfolio-health",
        "https://github.com/macel94/belacca-status/tree/main/history#portfolio-homepage"
      ]
    },
    {
      "id": "pong",
      "name": "Cloud Native Pong",
      "critical": true,
      "status": "operational",
      "summary": "All configured external checks passed.",
      "evidence_timestamp": "2026-10-14T13:42:12.161Z",
      "duration_ms": 30931,
      "source_references": [
        "https://github.com/macel94/belacca-status/actions/runs/38573974679",
        "https://github.com/macel94/belacca-status/tree/main/history#pong-health",
        "https://github.com/macel94/cloudnativepong/commit/f000673f44f8f0f386ab5f19a7dbe9be5516d672",
        "https://github.com/macel94/belacca-status/tree/main/history#pong-homepage",
        "https://github.com/macel94/belacca-status/tree/main/history#pong-journey"
      ]
    },
    {
      "id": "analytics",
      "name": "Analytics",
      "critical": false,
      "status": "operational",
      "summary": "All configured external checks passed.",
      "evidence_timestamp": "2026-10-14T13:42:12.161Z",
      "duration_ms": 597,
      "source_references": [
        "https://github.com/macel94/belacca-status/actions/runs/38573974679",
        "https://github.com/macel94/belacca-status/tree/main/history#analytics-status",
        "https://github.com/macel94/belacca-status/tree/main/history#analytics-count"
      ]
    },
    {
      "id": "operator",
      "name": "Operator journeys",
      "critical": false,
      "status": "unknown",
      "summary": "Authenticated operator checks are not configured.",
      "evidence_timestamp": "2026-10-14T13:42:12.161Z",
      "duration_ms": 0,
      "source_references": [
        "https://github.com/macel94/belacca-status/actions/runs/38573974679",
        "https://github.com/macel94/belacca-status/tree/main/history#dashboard-authenticated",
        "https://github.com/macel94/belacca-status/tree/main/history#flux-authenticated"
      ]
    }
  ],
  "incidents": [],
  "source_references": [
    "https://github.com/macel94/belacca-status/actions/runs/38573974679",
    "https://github.com/macel94/belacca-status/tree/main/history#platform"
  ],
  "notes": [
    "Automated external evidence published under a human-approved monitoring policy.",
    "This is an hourly observation from a GitHub-hosted runner, not multi-region monitoring.",
    "The status page is hosted in the same single-VM cluster and may be unavailable during a complete VM outage."
  ]
}
